The only concern i have is with the slighly all-business waitstaff who order and throw the food down  rushing you out.,0
Have the iced tea.,1
For Park avenue I expected so much more.,0
Small servings for main entree  i had salmon (wasnt impressed) girlfriend had chicken  it was good.,1
So rude.,0
you can actually get 2 salads worth if u take it home and add it to some lettuce!,0
The ambience is very romantic and definitely a good place to bring a date.,1
They are FAST.,1
It is far more popular as a bar than as a restaurant  with only a few tables and the waiter being the bartender  but we greatly enjoyed the unobtrusive atmosphere.,1
The food is very good for it's price  better than most fried dumplings I've had.,1
There are much better places in NY with better prices.,0
Very neighborhoody  very quick and sufficient.,1
Obv caviar is top of the line but the rest of the menu is so diverse it gives you a chance to taste so manydifferent varietys.,1
I ate here a week ago and found most dishes average at best and too expensive.,0
Everything is delicious  though  my gf and I come here once a week sometimes- you will get addicted!,1
And I could do without the cigar smoke.,0
Still  try it once  since if you end up loving the food  it could be one of your best dining experiences.,1
I've waited over one hour for food.,0
Other guests enjoyed pizza  santa fe chopped salad and fish and chips.,1
The ambience is very calm and quiet.,1
Both times I was extremely dissappointed by the service  which was boarderline rude.,0
Great deal!,1
Stay away from the latter since you won't go for seconds (hint hint).,0
not only does make the best pizza in NY   maybe anywhere.,1
The spicy Tuna roll is huge and probably the best that I've had at this price range.,1
Price and quality of fish alone will keep us from making a return visit.,0
Our waiter and all of the people helping him were attentive and genuine.,1
The place is a BISTRO which means: simple dishes and wine served efficiently in a bustling atmosphere.,1
This is one of the best comfort food places in the city.,1
Overall  the ingredients and technique are there and I am encouraged enough to return at lunch or dinner to see whether the boldness of the flavour palette improves.,1
I had a huge pastrami sandwich on a roll.,1
Though you will undoubtedly be seated at a table with what seems like barely enough room (no matter what the size of your party)  the warm atomosphere is worth the cramped quarters- you'll have fun and forgot about the tight spot you're in.,1
The fish was not fresh and the rice tasted old and stale.,0
Considering their price of $6.25 for lunch special  the dish was ridiculously small.,0
This is the pinnacle of Indian Fast Food (all fast foods in my opinion).,1
Besides  when you have bad service  that's less money you have to tip.,0
We do not need to go to a four-star restaurant anymore.,1
The wine list is also really nice.,1
I thanked my friend who recommended me this restaurant and will certainly recommend it to others.,1
I plan on stopping by next week as well.,1
Service was devine  oysters where a sensual as they come  and the price can't be beat!!!,1
Compared to Ess-a  Tal offers a less doughy bagel!,0
Ballato's is consistently delicious authentic italian food.,1
The service was attentive  yet discreet.,1
As a retired hipster  I can say with some degree of certainty that for the last year Lucky Strike has been the best laid-back late night in the city.,1
For those prices and the dressed up atmosphere you expect more and should get more.,0
Then  IF they answer the phone  you're lucky if they don't hang up on you!,0
They offer the same menu but have creative drinks that are loaded with alcohol and cheeky names -- but they do cost you.,1
We went to eat at the Jekyll and Hyde restaurant on Friday night and really enjoyed the fun atmosphere and good food.,1
The food was pretty tradional but it was hot and good with large portions.,1
Highly recommended to all!,1
highly recommended.,1
Unless you are eating in the Pizzeria side of this place  and are not in a rush  this place is a bad idea.,0
You have to increase the service a lot.,0
Ambiance is barely romantic but management tries.,0
I must warn the reader that the portions sizes are very small (especially the appetizers)  so if you plan to eat until you are full and do not intend to order the chef's special tasting menu  prepare to order and pay for an appetizer (1 dish for each person because the portions are not for sharing)  a main entree  and the cold udon at the end of the meal.,1
They were very abrupt with me when I called and actually claimed the food was late because they were out of rice.,0
After we got our sashimi order  I could not believe how small the portions were!,0
After the main course came  we didn't see our waiter for at least 40 MINUTES!,0
It will be on my to do list the next visit to NYC.,1
Nothing better than buying a snapple for $3.25 too.,1
When family came in he gave them apps to test their palets  and then ordered for them.,1
I was pleasantly surprised to find this gem in Hoboken.,1
Service is extraordinary  yet not overbearing  and the decor brings a taste of trendy SoHo into Queens.,1
The dosas are skimpy  unattractive and drip with grease  and personally I'd drink popcorn topping before I'd eat another one of these.,0
The service was excellent and the food was delicious.,1
If I wanted to deal with a crappy scene and annoying customers I'd go out in Manhattan.,1
After a seafood craving  i checked citysearch and chose to go to Fish based on a previous review and the citysearch info.,1
Right off the major deegan you get ladies from all over the city.,1
Until you realize that their five minutes is meaningless and your wait may be anywhere from two to twenty minutes it may be frustrating.,1
always fresh and delicious.,1
The food was very good  but not very thai.,1
Thalia is a beautiful restaurant with beautiful people serving you  but the food doesn't quite match up.,0
The fillings may be unconventional but the dosa batter is definitely authentic and the combinations very tasty.,1
This is the perfect spot for meeting friends  having lunch  dinner  pre-theatre or after-theatre drinks!,1
This is a fun restaurant to go to.,1
The mussaman curry that I ordered was as thin as water and aside from the poorly fried tofu that I ordered in it  they graciously provided me with ONE piece of poorly cooked potato.,1
Had a late night dinner on a Saturday night.,1
A restaurant that doesn't try to do anything except serve great food with great service in a pleasant atmosphere.,1
Their sake martini is wonderful.,1
Well  this place is so Ghetto its not even funny.,0
Bravissimo !!,1
Once they ran out of Gnochi and made it for me from scratch!,1
We would like to thank Marcelo and Grace for a wonderful dining experience!!!,1
Found service above average  but that could be because we were 13 of us.,1
When I arrived at Orsay I was thrown back  in a veyr good sense.,1
Bagels are ok  but be sure not to make any special requests!,1
This is the Cheers of New York  whether you've ever been there or not.,1
It's to die for!,1
Cute and decorative.,1
I know this is the case in many nyc eateries  but here  they really cram you in to the point where it's borderline uncomfortable.,0
fine dining restaurant quality.,1
Overall a disappointing experience for that price category.,1
I've had the lunch buffet at Chennai a couple of times  when I have been in the neighborhood.,1
The food was exceptional.,1
You will be satisfied.,1
Another great place to take out-of-towners!,1
But  hey  there is anything better with a decent vegetarian selection in Astoria.,1
We were less than impressed.,0
A Thai restaurant out of rice during dinner?,1
but still my date was bad,1
Would definitely go back again.,1
I have been to Rao's probably 15 times the past 3 years and it keeps getting better.,1
The portions are small but being that the food was so good makes up for that.,1
(and I have eaten my share) Which impresses me for having such a large amount of people to serve.,1
Sure  the setting is nice.,1
Overall a worthwhile experience.,1
The service is friendly  if not the most prompt in the world  the food is great  and the prices  while not cheap  won't put your wallet out of commission.,1
Had 1 appetizer  2 entrees and 2 cokes and the bill was ~$55.00  not including tip.,1
It's really a takeaway place  I wouldn't sit if I could take it home.,1
THE MOST FUN RESTAURANT I HAVE EVER BEEN TOO!,1
Best drumsticks over rice and sour spicy soup in town!,1
Some of the finest latin women you'll see in your life hang out at Jimmy's.,1
Slightly above average wines start at $70+ with only one selection listed at $30+.,0
Their whitefish salad is excellent--all whitefish with a little mayo.,1
And it all comes at a very reasonable price (congee  noodles  and rice dishes are no more than $3-6 each).,1
Nobody at this restaurant will give firm answers about anything and in the end  not one person takes responsibility for anything.,1
I had a great experience.,1
The chicken parm was edible but had canned tomato sauce and boxed pasta and the chicken with portobello mushrooms consisted of dry  inedible chicken with terrible sauce.,0
I recommend this place to everyone who asks me where to go for a good meal.,1
The waitresses are nice--also you can just get counter service sit.,1
The only friendly staff member was the guy at the bar.,1
Having been a long time Ess-a-Bagel fan  I was surpised to find myself return time and time again to Murray's.,1
Go for it!,1
Highly recommended.,1
You can certainly find restaurants that offer a superior fine dining experience  but for superb food at reasonable prices  La Villa can't be beat.,1
Won't or Can't is not in the service directory.,1
I cannot imagine a friendlier staff working in a restaurant.,1
I do suggest to ask to be seated upstairs if you are looking to be a little cozy.,1
To speak of the Park Side  words can not describe.,1
The red curry is weak and tasteless  the pad thai is stuck together and lumpy  the rice is often overcooked  and the seafood is pretty sketchy.,1
The wine list is extensive and can easily hike up an otherwise reasonably priced meal.,1
Saul is pretty good  but definitely not great.,0
I would recommend Roxy's for that  but not for their food.,1
We always get a sampling of appetizers and share.,1
Overall I was impressed and will return  it's a great QPR (Quality to Price Ratio).,1
It is nearly impossible to get a table  so if you ever have the chance to go here for dinner  DO NOT pass it up.,1
Their pad penang is delicious and everything else is fantastic.,1
The puke green walls leave a lot to be desired  but the food is very good.,1
The flavors are very fresh and pretty inobtrusive  nothing flashy.,1
I like Cafe Noir dont get me wrong  it is jsut that the people who work there are evil and incompetent!!,1
The hanger steak was like rubber and the tuna was flavorless not to mention it tasted like it had just been thawed.,0
But $1 for each small piece???,0
Our son loves pizza and we have a certified Neapolitan pizzaria in our home city (Seattle)  we liked this nearly as much - and the differences were more about personal preference than any reflection on either restaurant.,1
big and soft as well as good lunch food.,1
No food snobs allowed  this place is for people who appreciate good food.,1
I liked the food at this quasi-thai restaurant.,1
By far the best salad I have had in a fast food restaurant.,1
Suan is a great place that I often take my friends (classmates) too.,1
Not a great place for family or general dining.,0
As for the bar  this is another bad idea.,0
Their bagels are fine  but they are a little overcooked  and not really a 'special' bagel experience.,1
Unlike HH up the block  this place actually gives you hearty and hot bagels this town is known for.,1
I thought going to Jimmys would give me a real Domincan exprience.,1
The barebecued salmon is elegantly spiced and not at all dry.,1
Same owner as the guy who owns Typhoon  which is just down the street on St. Marks and 1st Ave.,1
What generous portions!,1
The workers there also absolutely load the bagel with cream cheese (gets a little messy).,1
I was wrong.,0
The wine the service was very good too.,1
So  the menu is written in chalk above your head and it all sounds delicious.,1
The highly spiced chai tea was great too.,1
No plans to return anytime soon.,0
I have been there many times  and food is good and consistent.,1
Seriously  this is the best all you can eat in town- As everyone says  the Spicy Tuna hand rolls are the best- have 4 of these  and you've broken even.,1
There is not a single place in Chinatown where you have a nice neighborhood feeling like here.,1
While Sapphire is certainly not lacking in ambiance  and probably has the best decor of any Indian restaurant I have been to in New York City  the food was not what I had hoped for.,0
I would highly recommend this place to anyone looking for a casual atmosphere that whisks you away to the left bank of the river Seine.,1
I just do not understand what the fuss is all about.,0
The meat dishes were only so-so.,1
His wife Tanya  the hostess  completes the comforting atmosphere by being delightfully warm and gracious.,1
We liked it so much  that we will always make it a point to dine here when we visit New York.,1
The menu consisted of standard brassiere food  better then places like Balthazar etc.,1
I have been a longtime fan of Holy Basil in the East Village  and while I do believe their food has slightly slipped in quality  I have been hesitant to be disloyal.,0
But the best part about LS is the late night atmosphere  delightfully free of the BTs.,1
For an untrendy rip-off- eat here.,0
And you're hungry a few hours later.,1
I can't wait to go back.,1
I HATE HATE HATE this place.,0
We even had a visit from the Manager who wanted to make sure we were enjoying ourselves.,1
The staff there is very attentive and down to earth.,1
You don't go to Mizu for excellent service  you go for the large amounts of food  the amiable atmosphere  and the hole-in-the-wall feeling of the place.,1
The service is always bad though  don't expect much of anything from your server  and I would not recommend bringing a date here either.,0
Monday nights are a bargain at the $28 prix fix - this includes a three course meal plus *three* glasses of wine paired with each course.,1
Wonderful!,1
It took them 15 minutes to put water in our glasses.,0
The service is descent even when this small place is packed.,1
This is the best sushi in new york city - hands down.,1
Go hungry and enjoy.,1
I have eaten a lot of pizza here.,1
This place is worth an one-hour drive.,1
Great value for the quality ingredients.,1
The Thali was small  thoroughly unremarkable  and $14.95.,0
The sushi is also great!,1
From the complimentary chef app of a delicate butternut squash ravioli in a delicious truffle sauce to an amazing buttery and tender langostine entree to a dessert that I can't remember because of the fabulous Cakebread Cabernet we were drinking -- the whole evening was amazing.,1
Truly the mark of an attentive waiter.,1
The food here is rather good  but only if you like to wait for it.,1
I got an excellent piece of cheesecake and we had several other nice pastries.,1
The staff is very kind and well trained  they're fast  they are always prompt to jump behind the bar and fix drinks  they know details of every item in the menu and make excelent recomendations.,1
The makhani was OK --the korma was bland.,0
The food is inventive but still keeps traditional indian flavoring.,1
All I can say is WOW!,1
though the service could be better (possibly due to more than one very large group in the house)  it is very cordial and warm  as is the general clientele.,1
The decor in this place is very diner-ish and the kind of place you expect in the East Village - not romantic  just simple  small and sparse.,1
This is a cute place and could be good but they need to get their act together.,1
The lox is always fresh too.,1
Sure enough  exactly 30 minutes later we got the call and were seated promptly.,1
Service was very friendly.,1
So all I'm trying to say is this restaurant is by far the best thai food restaurant I've ever been to.,1
Food was OK - fish was cooked well.,1
We actually left hungry and went across the street to Wo Hop at 15 Mott street for some good chinese food.,0
The duck confit is always amazing and the foie gras terrine with figs was out of this world.,1
The whole set up is truly unprofessional and I wish Cafe Noir would get some good staff  because despite the current one this is a great place.,0
The service does sometimes lack focus and it is not ideal if you are in a hurry but I have never been treated rudely.,1
I have reservations about the all you can eat deal  however -- the choices are fairly limited and you can probably order more food than you can eat for less than $18 by just going off the menu.,0
The staff offers impeccable service.,1
The catch is that you are charged extra for ANYTHING that you leave on your plate so don't be a greedy pig!,0
We ended our great experience by having Gulab Jamun (dessert) recommended by the waiter.,1
wont come back again for sure!,0
i went to utsav about a yr ago with my family.,1
This place doesn't compare with Mamoun's in terms of price  freshness  value  and consisent quality  but that's just my opinion.,1
The place is sleek  modern and playfull and i will return again frequently.,1
I have known about this secret for the last 13 years  Emilio(the Godfather) has continued to serve food and wine for the gods at mortal prices.,1
The brioche and lollies as party favors is a cute and sweet touch to a most memorable meal.,1
After being told that our party of three would be seated in 10 minutes and watching other parties (multiples of 2 and higher) seated for 40 minutes  the three of us were squished into a small 2-person table.,0
And the bill was outragous.,0
The service was attentive  yet unimposing  the food was far better than many notorious restaurants in Midtown and the wine list is extensive and well priced.,1
Kind  attentive wait staff.,1
Bon appettite!!,1
Salads were fantastic.,1
The owners and employees are friendly and their pizza is fantastic.,1
La Rosa waltzes in  and I think they are doing it the best.,1
The food is yummy  especially their cooked-to-perfection mussels in spicy tomato sauce and their shoestring crispy fries.,1
The food is authentic Italian - delicious!,1
A great addition to Smith Street: finally  a place that's not pretentious and filled with women wearing Ugg boots.,1
skip dessert.,1
We spent $200 in this place and left hungry and very disappointed.,0
It is simply amazing.,1
I complete the total bagel experience by having it lightly toasted.,1
It was like the servers forgot that they actually worked there and instead wanted to hang out and be cool.,0
I liked this place the first time but doubt I will ever return.,0
The service is good and ambience is good for a date or group outing.,1
A great way to make some money is to buy a case of snapple from Costco and sell it right outside for only $2.50.,1
It's all about the food !!,1
Fast service.,1
Skip this restaurant  it's a big disappointment.,1
The staff is excellent  specjal: that girl behind the bar  european chic.,1
stick with the chicken  beef  and lamb dishes.,1
The service was bad  the food took to forever to come  we sat on the upper level.,1
We a menu that rearely changes e xcept for one or two specials  the quality and care they put in thier food in evident.,1
ALWAYS full with tourists (especially because of it's close proximity to Rockefeller Center).,1
The decor is nice  but more casual than fine dining.,1
This restaurant is a wonderful place to go many times and it is reasonably priced.,1
Bravo  Blue Hill!,1
Conveniently located too  being right on Bedford ave.,1
My friends and I came across this place while walking in the village.,1
Bottom line: B+ for the food  F for the service.,1
The only thing the waiters don't do for you is wipe your chin when you leave.,1
This place is to be avoided.,0
Stick to dimsum  not super overpriced noodles.,0
The service is fine and they allow you to enjoy the view.,1
My sister says it reminds her of a restaurant run by high-school students who don't know what they are doing.,0
We  there were four of us  arrived at noon - the place was empty - and the staff acted like we were imposing on them and they were very rude.,0
At 6:30  we were the third party there.,1
delicious simple food in nice outdoor atmosphere.,1
I will definetly be going back.,1
No  really.,1
The food is good  but very expensive for the casualness of it.,0
The only fallback on this restaurant is the prices.,0
I've been to Naples 45 for dinner twice.,1
The hot and sour soup was unbearably hot and tasted of only pepper and nothing else.,0
i love the pics of andy warhol when he used to frequent the place (he painted the ballato's sign in the window).,1
Try sushimi cucumber roll.,1
I'm saving up for my next visit.,1
The food is delicious.,1
Their wines by the glass are a great accompaniment and you can eat like a king with wine for under $30.,1
This place has the the correct ambience and an excellent staff to make you feel like a guest and a friend at the same time.,1
Amma is nothing special.,0
Yeah Shanghai is also great but not quite as good -- they use the same amount of salt but without sweetness to balance out.,0
believe us  we've been eating sushi for over 15 yrs.,1
Worth it for a special occasion  or any time!,1
The atmosphere is much better than Sripraphai (more modern and sleek).,1
I recommend to anyone who wants to dress up and impress the lady.,1
The food is outstanding and the service is quick  friendly and very professional.,1
The bagels always warm  soft on the inside  crispy on the outside and enormous in size.,1
I had a late dinner at Lucky Stike  a great name for a joint if ever I saw one.,1
Been there  done that  and New York  it's not that big a deal.,1
Definitely a once a year treat that I look forward to around the holidays!,1
Service is fast and friendly.,1
from an English speaking staff.,1
Anyhow  we were able to sit as long as we wanted and chat  which was nice.,1
And they have these home made potato chips at the bar that are the most delicious things in the world!,1
A defitely must visit.,1
My husband and I enjoyed each of the 6 taste size portions and left completely full.,1
I went here with a friend on a whim  we went someplace else first and couldn't get a table.,0
We all ate pasta entre'es  which were great.,1
My friends and I showed up on a Sat.,1
The steak was excellent and one of the best I have had (I tasted the butter intitally but in no way did it overwhelm the flavor of the meat).,1
great experience overall.,1
PERFECT FOR DATES!,1
The food was boring and expensive.,0
The ambience is pretty and nice for conversation  so a casual lunch here would probably be best.,1
Terrific menu full of unique rolls and special dishes.,1
The service is ok but could be better.,0
We love the food  drinks  and atmosphere!,1
I was here a few weeks back and we had the worst customer service experience at a restaurant ever.,0
(I've ordered from the 2nd ave.,1
Nothing against a good sales call  but the tactics at Amma are just too obvious.,0
Went on a 3 day oyster binge  with Fish bringing up the closing  and I am so glad this was the place it O trip ended  because it was so great!,1
Took my mom for Mother's Day  and the maitre d' was pretty rude.,0
My husband and I have been there a couple of times and each time we sat at the sushi bar (chef Yoshi) and ordered everything ala carte.,1
The vibe is very relaxed and cozy  service was great and the food was excellent!,1
If the weather is nice  try to snag an outside table.,1
If you are looking for a good quality  cheap eats - this is the place.,1
However  for what we spent  overall  it just was not up to par.,0
The service was friendly and the atmosphere was casual.,1
A friend from Seattle and I went on a Thursday night around 8:30.,1
When I lived upstate for a while I would buy freeze the bagels and they would still be better than any else.,1
I recommend their Pad See Ew  Pork Chops or Tofu plates.,1
Never in my life did I think that I could be satisfied both in taste and in quantity for $3.00 in NYC.,1
this is the best secret place in midtown'  I heard that from the bartender  after having brilliant food ( try steak with portobello mushrooms) and drinks on the bar last Tuesday.,1
The service was excellent - friendly and attentive.,1
The main course had an average portion  and was decent overall.,1
20 minutes for our reservation but it gave us time to have a few cocktails and enjoy our surroundings and each other.,1
Just remember  the later you go  the longer you may have to wait.,1
Waitstaff is great  very attentive.,1
I live in the neightborhood and am a regular.,1
The dinner menu is diverse and top-notch as well.,1
IT IS WHAT MODERN CUISINE IS ALL ABOUT.,1
In any event  even though its a bit on the pricey side  we still love this restaurant and will definitely go back.,1
I definitely will go back.,1
I don't like Indian food too much and this was delicious  however you want to factor that into the equation.,1
at taj  vegetarians can rejoice-all the dishes are manna from heaven.,1
Finally!,1
Forget the rush and the wait and the noise (which isn't actually that bad)  I mean please  who goes to a steakhouse to be coddled and romantic?,1
Having hunted around for a quiet  romantic  yet not hideously expensive restaurant I stumbled across reviews for La Lanterna and gave it a shot.,1
I've never been disappointed.,1
I won't go back unless someone else is footing the bill.,0
